{
  "type": "BindingProposal",
  "modelId": "8c1f6d0e-5d0b-4c39-9a52-0f1c0d7a2b11",
  "interfaceRevision": 6,
  "profileRevision": 8,
  "simulationId": "dewb-session-3f2a",
  "signalInterfaceRevision": "1",
  "mappings": [
    {
      "joint": "joint-10",
      "signal": "carriage.position",
      "sourceQuantity": "position",
      "sourceUnit": "mm",
      "jointQuantity": "position",
      "jointUnit": "m",
      "unitToSI": 0.001,
      "scale": 1.0,
      "offset": 0.0,
      "initialCoordinate": null
    },
    {
      "joint": "joint-12",
      "signal": "spindle.speed",
      "sourceQuantity": "angular_velocity",
      "sourceUnit": "rpm",
      "jointQuantity": "angle",
      "jointUnit": "rad",
      "unitToSI": 0.10471975511965977,
      "scale": 1.0,
      "offset": 0.0,
      "initialCoordinate": 0.0
    }
  ]
}
